{
  "avoid_list": [
    {
      "detail": "Oct-2026 tightening CONFIRMED multi-source (Digital Trends, ppc.land, Storyboard18, NeoTeo): from Oct 1, 2026, Shorts recommendations prioritize original content and cut reach for re-uploads without meaningful additions; clipping payments KSh 130-520 per 1K views (Kenyan Mirror, Oct 5, 2026); reposted clips with little commentary are flagged unoriginal and FYP-ineligible on TikTok. From Feb 1, 2027, Shorts revenue sharing needs 10M qualified Shorts views per 90 days (multi-source) - a second cliff for repost-heavy Shorts channels.",
      "id": "clipping-reposts",
      "name": "Clipping / repost channels",
      "sources": [
        "digitaltrends-shorts",
        "kenyanmirror",
        "buytiktok",
        "auditsocials-ypp"
      ],
      "flag_2027": true
    },
    {
      "detail": "YouTube's January 2026 inauthentic-content enforcement removed 16 major channels (4.7B combined views) and demonetized thousands of low-effort AI channels (UTubeKit, Jul 2026). Risky faceless formats: AI personas giving money or health advice (unmonetizable), article readings, clip compilations, templated top-5 lists (Synthesys, Oct 2026). Faceless still works, but only with visible human creativity.",
      "id": "ai-slop",
      "name": "Low-effort AI slop",
      "sources": [
        "utubekit",
        "synthesys",
        "lilachbullock"
      ],
      "flag_2027": false
    },
    {
      "detail": "Fastest channel growth measured (1.59%/mo) but the worst pay: $0.33 RPM, about 3M views to earn $1,000 (AIR Media-Tech). Growth is not revenue. Made-for-kids content also faces strict ad rules. 2027 update: Shorts-heavy kids channels also face the Feb-2027 10M-views/90d Shorts revenue floor (multi-source).",
      "id": "kids-trap",
      "name": "The kids-content trap",
      "sources": [
        "air-tubeai"
      ],
      "flag_2027": true
    },
    {
      "detail": "Documented removal risk on TikTok (buyTikTokAccount, Aug 2026).",
      "id": "tiktok-gambling-crypto",
      "name": "Gambling / crypto on TikTok",
      "sources": [
        "buytiktok"
      ]
    },
    {
      "detail": "Flagged and FYP-ineligible (buyTikTokAccount, Aug 2026). Health education is fine; claims and diagnoses are not.",
      "id": "tiktok-medical-claims",
      "name": "Medical-advice claims on TikTok",
      "sources": [
        "buytiktok"
      ]
    },
    {
      "detail": "FYP-ineligible as a category (buyTikTokAccount, Aug 2026).",
      "id": "tiktok-news-politics",
      "name": "Pure news / politics on TikTok",
      "sources": [
        "buytiktok"
      ]
    },
    {
      "id": "shorts-only-post-2027",
      "name": "Shorts-only channels chasing pool revenue (post-Feb-2027)",
      "detail": "From Feb 1, 2027, Shorts ad + subscription revenue sharing requires 10M qualified Shorts views per 90 days, checked monthly - below it the Shorts pool pays nothing that month (announced Aug 10, 2026; multi-source: AIR, AuditSocials, Tablet News, GSMDome). Shorts RPMs were already 3-14% of long-form (AIR, 274 channels). A Shorts-only channel with no long-form catalog is building on the thinnest revenue layer there is.",
      "sources": [
        "auditsocials-ypp",
        "air-monetization-2027"
      ],
      "flag_2027": true
    }
  ],
  "growth_context": "Channel-growth figures below are median monthly subscriber growth among 10K-100K-subscriber YouTube channels in the AIR Media-Tech / TubeAI study (Sep 7-27, 2026). The all-channel median was 0.97%/mo. Medians hide huge variance, they describe the middle of a cohort, not your outcome.",
  "niches": [
    {
      "breakout_rate": "10.0% of videos beat channel average 10x",
      "case_file": null,
      "caveats": [
        "Channel growth 1.44%/mo is the AI & ML cohort median (TubeAI, Sep 2026).",
        "Competition rising fast, speed and specificity beat breadth here."
      ],
      "channel_growth_monthly_pct": 1.44,
      "chapter_links": [
        {
          "label": "Phase 2: YouTube Mastery",
          "page": "phase-2-youtube-mastery.html"
        },
        {
          "label": "Phase 5: The Monetization Stack",
          "page": "phase-5-monetization-stack.html"
        }
      ],
      "competition": "medium",
      "formats": [
        "long-form",
        "shorts"
      ],
      "id": "ai-tools",
      "name": "AI Tools & Automation",
      "platforms": [
        "YouTube long-form",
        "TikTok",
        "YouTube Shorts"
      ],
      "revenue_figures": [
        {
          "hi": 20,
          "kind": "CPM",
          "lo": 8,
          "note": "creator-reported (OutlierKit, Sep 2026)"
        }
      ],
      "revenue_tier": "high",
      "search_growth_pct": 340,
      "simulator_scenario": null,
      "single_source": false,
      "skill_fit": [
        "teaching",
        "research"
      ],
      "sources": [
        "air-tubeai",
        "outlierkit-search",
        "outlierkit-breakout"
      ],
      "startup_cost": "low",
      "summary": "Tutorials and breakdowns of AI tools, prompts, and automation workflows, the fastest-rising search niche of 2026.",
      "outlook_2027": {
        "trajectory": "heating",
        "basis": "AI tutorials measured 18x growth at $15-22 CPM (OutlierKit trending guide, Sep 2026); AI tools still the fastest-rising search niche (+340%). Competition rising fast - speed and specificity win.",
        "signals": [
          "outlierkit-trending",
          "outlierkit-search",
          "haberman-2027"
        ]
      },
      "stream_fit": {
        "ads": "strong",
        "sponsorships": "strong",
        "digital_products": "strong",
        "pod": "moderate"
      }
    },
    {
      "breakout_rate": null,
      "case_file": null,
      "caveats": [
        "'Most underserved' and the $10-25 CPM range both come from one source (OutlierKit). Screen-recorded tutorials keep startup cost near zero."
      ],
      "channel_growth_monthly_pct": null,
      "chapter_links": [
        {
          "label": "Phase 2: YouTube Mastery",
          "page": "phase-2-youtube-mastery.html"
        },
        {
          "label": "Phase 5: The Monetization Stack",
          "page": "phase-5-monetization-stack.html"
        }
      ],
      "competition": "low",
      "formats": [
        "long-form",
        "shorts"
      ],
      "id": "no-code-automation",
      "name": "No-Code & Automation Workflows",
      "platforms": [
        "YouTube long-form",
        "YouTube Shorts"
      ],
      "revenue_figures": [
        {
          "hi": 25,
          "kind": "CPM",
          "lo": 10,
          "note": "creator-reported (OutlierKit, Sep 2026)"
        }
      ],
      "revenue_tier": "high",
      "search_growth_pct": 220,
      "simulator_scenario": null,
      "single_source": true,
      "skill_fit": [
        "teaching",
        "research"
      ],
      "sources": [
        "outlierkit-search"
      ],
      "startup_cost": "low",
      "summary": "No-code tools, Zapier/Make-style automations, and AI-agent workflows for businesses, called the most underserved niche in the 2026 research.",
      "outlook_2027": {
        "trajectory": "heating",
        "basis": "Search demand +220% with the 'most underserved' label (OutlierKit). Single-source - lighter evidence, but the direction matches the platform AI/automation push.",
        "signals": [
          "outlierkit-search"
        ]
      },
      "stream_fit": {
        "ads": "strong",
        "sponsorships": "strong",
        "digital_products": "moderate",
        "pod": "weak"
      }
    },
    {
      "breakout_rate": "16.7% of videos beat channel average 10x",
      "case_file": {
        "page": "case-ptya.html",
        "title": "The Cohort Course"
      },
      "caveats": [
        "The math forgives a small audience, but never present ranges as earnings. Educational content, not financial advice."
      ],
      "channel_growth_monthly_pct": null,
      "chapter_links": [
        {
          "label": "Phase 5: The Monetization Stack",
          "page": "phase-5-monetization-stack.html"
        },
        {
          "label": "Phase 7: The Business",
          "page": "phase-7-the-business.html"
        }
      ],
      "competition": "high",
      "formats": [
        "long-form",
        "shorts"
      ],
      "id": "gen-z-finance",
      "name": "Gen Z Personal Finance",
      "platforms": [
        "YouTube long-form",
        "TikTok",
        "YouTube Shorts"
      ],
      "revenue_figures": [
        {
          "hi": 45,
          "kind": "CPM",
          "lo": 18,
          "note": "creator-reported (OutlierKit/Famety, 2026)"
        },
        {
          "hi": 35,
          "kind": "RPM",
          "lo": 8,
          "note": "finance/business band (OutlierKit, Jun 2026); roughly 7x gaming/entertainment"
        }
      ],
      "revenue_tier": "high",
      "search_growth_pct": 180,
      "simulator_scenario": "personal-finance",
      "single_source": false,
      "skill_fit": [
        "teaching",
        "research"
      ],
      "sources": [
        "outlierkit-search",
        "outlierkit-cpm",
        "famety",
        "outlierkit-breakout"
      ],
      "startup_cost": "low",
      "summary": "Budgeting, investing basics, and money psychology for a young audience, the highest breakout rate of any niche measured.",
      "outlook_2027": {
        "trajectory": "stable",
        "basis": "Highest breakout rate measured (16.7%) with $8-35 RPM ranges, but competition is high - and AIR's studio medians (May 2025-May 2026) sit far lower than advertiser CPMs suggest. Rates are real; they are not a floor.",
        "signals": [
          "outlierkit-breakout",
          "outlierkit-cpm",
          "air-monetization-2027"
        ]
      },
      "stream_fit": {
        "ads": "strong",
        "sponsorships": "strong",
        "digital_products": "strong",
        "pod": "weak"
      }
    },
    {